{
  "targets": [
    {
      "id": 1,
      "url": "https://example.com/",
      "label": "Example"
    }
  ],
  "devices": [
    {
      "id": 1,
      "name": "Desktop",
      "slug": "desktop",
      "viewport_width": 1440,
      "viewport_height": 900,
      "device_scale_factor": 1,
      "is_mobile": false,
      "has_touch": false
    }
  ],
  "settings": {
    "navigation_timeout_ms": 30000,
    "image_timeout_ms": 10000,
    "lazy_load": true,
    "concurrency": 2,
    "pixel_threshold": 0.2,
    "review_threshold": 0.001,
    "changed_threshold": 0.01,
    "ignore_selectors": []
  },
  "allowed_origins": [
    "https://example.com"
  ]
}
